<?xml version="1.0" encoding="UTF-8" ?>

<FinancieleEenheden xmlns:xsi="http://www.w3.org/2001/XMLSchema-instance" xsi:noNamespaceSchemaLocation="FinancieleEenheden.xsd">
  <FinancieleEenheid>
    <TeNaamStelling>one</TeNaamStelling>
    <AdresId>_1Kl5IFRBEeK2xboPrrxLcg</AdresId>
    <Personen>
      <PersoonId>_g3YpMFRCEeK_HqJvNMtzVA</PersoonId>
      <PersoonId>_g3YpMVRCEeK_HqJvNMtzVA</PersoonId>
      <PersoonId>_g3YpMlRCEeK_HqJvNMtzVA</PersoonId>
      <PersoonId>_g3YpM1RCEeK_HqJvNMtzVA</PersoonId>
    </Personen>
  </FinancieleEenheid>
  <FinancieleEenheid>
    <TeNaamStelling>Het gezin</TeNaamStelling>
    <AdresId>_1Kl5IVRBEeK2xboPrrxLcg</AdresId>
    <Personen>
      <PersoonId>_g3YpNVRCEeK_HqJvNMtzVA</PersoonId>
      <PersoonId>_g3YpNFRCEeK_HqJvNMtzVA</PersoonId>
      <PersoonId>_g3YpM1RCEeK_HqJvNMtzVA</PersoonId>
    </Personen>
  </FinancieleEenheid>
  <FinancieleEenheid>
    <TeNaamStelling>The company</TeNaamStelling>
    <AdresId>_1Kl5IVRBEeK2xboPrrxLcg</AdresId>
    <Personen>
      <PersoonId>_g3YpMFRCEeK_HqJvNMtzVA</PersoonId>
      <PersoonId>_g3YpNVRCEeK_HqJvNMtzVA</PersoonId>
    </Personen>
  </FinancieleEenheid>
</FinancieleEenheden>
